{
  "id": "css",
  "purpose": "Native CSS transitions/animations \u2014 the default when sufficient.",
  "triggers": [
    "hover",
    "fade",
    "simple entrance",
    "micro-interaction",
    "loading spinner (simple)"
  ],
  "exclusions": [
    "complex sequencing",
    "runtime-controlled playback (waapi/js)",
    "designer assets",
    "3D"
  ],
  "required_shared_modules": [
    "GOV-A11Y",
    "GOV-PERF",
    "GOV-READINESS",
    "GOV-CONFIDENCE",
    "GOV-DEPTH"
  ],
  "canonical_skill": "skills/animation-router/SKILL.md",
  "modules": [
    {
      "id": "css.patterns",
      "source": "references/library-decision-matrix.md",
      "sections": [
        "Quick Selection Guide"
      ],
      "load_when": [
        "implementation"
      ],
      "required": false
    },
    {
      "id": "css.scroll-timeline",
      "source": "references/browser-support.md",
      "sections": [
        "CSS Animation Features"
      ],
      "load_when": [
        "intent:scroll"
      ],
      "required": false
    }
  ],
  "workflows": [
    "implementation",
    "code-review",
    "accessibility-review"
  ],
  "example_tags": [
    "css",
    "fade",
    "hover"
  ],
  "evidence_requirements": [
    "browser support policy"
  ],
  "implementation_blockers": [],
  "readiness_requirements": [
    "prefers-reduced-motion media query",
    "transform/opacity only by default"
  ]
}
