{
  "id": "motion",
  "purpose": "Motion (vanilla) \u2014 WAAPI-based library animation outside React.",
  "triggers": [
    "vanilla motion",
    "waapi library",
    "spring outside react"
  ],
  "exclusions": [
    "React (motion-react)",
    "complex scroll orchestration (gsap)"
  ],
  "required_shared_modules": [
    "GOV-VERSION",
    "GOV-OWNERSHIP",
    "GOV-A11Y",
    "GOV-READINESS",
    "GOV-CONFIDENCE",
    "GOV-DEPTH"
  ],
  "canonical_skill": "skills/motion/SKILL.md",
  "modules": [
    {
      "id": "motion.core",
      "source": "skills/motion/SKILL.md",
      "sections": [
        "Goal",
        "Version and Package Gate"
      ],
      "load_when": [
        "implementation",
        "code-review",
        "debugging"
      ],
      "required": true
    }
  ],
  "workflows": [
    "implementation",
    "code-review",
    "debugging",
    "migration",
    "production-readiness"
  ],
  "example_tags": [
    "motion"
  ],
  "evidence_requirements": [
    "motion package version"
  ],
  "implementation_blockers": [
    "unknown version"
  ],
  "readiness_requirements": [
    "version verified",
    "controls stopped on teardown",
    "reduced-motion handled"
  ]
}
