{
  "id": "animejs",
  "purpose": "Lightweight vanilla JS animation for DOM/SVG without React coupling.",
  "triggers": [
    "vanilla js animation",
    "svg morph",
    "lightweight sequence"
  ],
  "exclusions": [
    "React declarative (motion-react)",
    "heavy scroll orchestration (gsap)",
    "3D"
  ],
  "required_shared_modules": [
    "GOV-VERSION",
    "GOV-OWNERSHIP",
    "GOV-A11Y",
    "GOV-READINESS",
    "GOV-CONFIDENCE",
    "GOV-DEPTH"
  ],
  "canonical_skill": "skills/animejs/SKILL.md",
  "modules": [
    {
      "id": "animejs.core",
      "source": "skills/animejs/SKILL.md",
      "sections": [
        "Goal",
        "Version and Package Gate"
      ],
      "load_when": [
        "implementation",
        "code-review",
        "debugging"
      ],
      "required": true
    }
  ],
  "workflows": [
    "implementation",
    "code-review",
    "debugging",
    "migration",
    "production-readiness"
  ],
  "example_tags": [
    "animejs"
  ],
  "evidence_requirements": [
    "animejs major version (v3 vs v4 API split)"
  ],
  "implementation_blockers": [
    "unknown major version"
  ],
  "readiness_requirements": [
    "version verified",
    "animations removed on teardown",
    "reduced-motion handled"
  ]
}
