{
  "id": "motion-react",
  "purpose": "React declarative animation: presence, layout, gestures, variants.",
  "triggers": [
    "react enter/exit",
    "list presence",
    "gesture-driven react",
    "layout animation"
  ],
  "exclusions": [
    "non-React",
    "scroll orchestration (gsap)",
    "designer assets",
    "3D"
  ],
  "required_shared_modules": [
    "GOV-VERSION",
    "GOV-OWNERSHIP",
    "GOV-A11Y",
    "GOV-READINESS",
    "GOV-CONFIDENCE",
    "GOV-DEPTH"
  ],
  "canonical_skill": "skills/motion-react/SKILL.md",
  "modules": [
    {
      "id": "motion-react.core",
      "source": "skills/motion-react/SKILL.md",
      "sections": [
        "Goal",
        "Version and Package Gate"
      ],
      "load_when": [
        "implementation",
        "code-review",
        "debugging"
      ],
      "required": true
    },
    {
      "id": "motion-react.presence",
      "source": "skills/motion-react/SKILL.md",
      "sections": [
        "Lifecycle and Presence Strategy"
      ],
      "load_when": [
        "intent:enter-exit"
      ],
      "required": false
    },
    {
      "id": "motion-react.a11y-ext",
      "source": "skills/motion-react/SKILL.md",
      "sections": [
        "Accessibility"
      ],
      "load_when": [
        "implementation",
        "accessibility-review"
      ],
      "required": false
    }
  ],
  "workflows": [
    "implementation",
    "code-review",
    "debugging",
    "accessibility-review",
    "migration",
    "production-readiness"
  ],
  "example_tags": [
    "motion-react",
    "presence",
    "stagger"
  ],
  "evidence_requirements": [
    "motion vs framer-motion package + version",
    "react version"
  ],
  "implementation_blockers": [
    "unknown package identity (motion/react vs framer-motion)"
  ],
  "readiness_requirements": [
    "version verified",
    "useReducedMotion respected",
    "exit cleanup verified"
  ]
}
