{
  "id": "threejs",
  "purpose": "3D/WebGL scenes, product viewers, shaders.",
  "triggers": [
    "3d",
    "webgl",
    "product viewer",
    "3d model",
    "shader"
  ],
  "exclusions": [
    "2D DOM motion",
    "designer 2D assets"
  ],
  "required_shared_modules": [
    "GOV-VERSION",
    "GOV-OWNERSHIP",
    "GOV-A11Y",
    "GOV-SECURITY",
    "GOV-PERF",
    "GOV-READINESS",
    "GOV-CONFIDENCE",
    "GOV-DEPTH"
  ],
  "canonical_skill": "skills/threejs/SKILL.md",
  "modules": [
    {
      "id": "threejs.core",
      "source": "skills/threejs/SKILL.md",
      "sections": [
        "Goal",
        "Version and Package Gate"
      ],
      "load_when": [
        "implementation",
        "code-review",
        "debugging"
      ],
      "required": true
    },
    {
      "id": "threejs.disposal",
      "source": "skills/threejs/SKILL.md",
      "sections": [
        "Ownership and Disposal"
      ],
      "load_when": [
        "implementation",
        "debugging",
        "code-review"
      ],
      "required": true
    },
    {
      "id": "threejs.r3f",
      "source": "skills/threejs/SKILL.md",
      "sections": [
        "Scene / Implementation Strategy"
      ],
      "load_when": [
        "framework:react"
      ],
      "required": false
    }
  ],
  "workflows": [
    "implementation",
    "code-review",
    "debugging",
    "performance-review",
    "security-review",
    "production-readiness"
  ],
  "example_tags": [
    "threejs",
    "disposal"
  ],
  "evidence_requirements": [
    "three version",
    "r3f version if React",
    "asset formats/origin",
    "shared-resource ownership"
  ],
  "implementation_blockers": [
    "unknown three version",
    "undefined shared-resource ownership"
  ],
  "readiness_requirements": [
    "version verified",
    "dispose geometry/material/texture",
    "loop cancelled",
    "non-visual fallback for essential content"
  ]
}
